{
  "item_id": "0192f5a0-7c1e-7d3a-9b2e-5f6a7b8c9d0e",
  "acceptance": [
    {
      "kind": "command",
      "id": "cmd_build",
      "title": "Build succeeds",
      "run": "cargo build --release",
      "expect_exit": 0,
      "cwd": null
    },
    {
      "kind": "test",
      "id": "test_unit",
      "title": "Unit tests pass",
      "name": "cargo test --lib",
      "runner": null
    },
    {
      "kind": "metric",
      "id": "metric_coverage",
      "title": "Code coverage above 80%",
      "name": "coverage",
      "op": "gte",
      "threshold": 80.0,
      "unit": "%",
      "command": "cargo llvm-cov --summary-only",
      "pattern": "TOTAL.*?([0-9.]+)%"
    },
    {
      "kind": "file",
      "id": "file_readme",
      "title": "README exists",
      "path": "README.md"
    },
    {
      "kind": "absent",
      "id": "absent_todo",
      "title": "No TODO comments",
      "path": "TODO.md"
    },
    {
      "kind": "manual",
      "id": "manual_review",
      "title": "Code reviewed by maintainer",
      "text": "A maintainer must review and approve the changes"
    }
  ],
  "constraints": [
    {
      "kind": "forbidden_path",
      "glob": "src/temp/*"
    },
    {
      "kind": "allowed_dependency",
      "name": "serde"
    },
    {
      "kind": "max_changed_files",
      "n": 10
    },
    {
      "kind": "note",
      "text": "Keep database migrations minimal"
    }
  ],
  "definition_of_done": "All criteria met and approved by the team lead",
  "risk": "medium",
  "created_at": "2026-10-05T10:00:00Z",
  "updated_at": "2026-10-05T10:00:00Z"
}
